{
  "schema_version": "readingpaper.literature_index.v1",
  "created_by": "relevantpaper",
  "project_dir": ".",
  "created_at": "2026-05-26T00:00:00+00:00",
  "seeds": [],
  "papers": [],
  "summary": {
    "seed_count": 1,
    "resolved_seed_count": 1,
    "candidate_count_raw": 2,
    "candidate_count_deduped": 2,
    "ranked_count": 2,
    "downloaded_count": 0,
    "manual_review_count": 0
  },
  "backend_status": {}
}
